prime_award_unique_key,prime_award_piid,prime_award_parent_piid,prime_award_amount,prime_award_disaster_emergency_fund_codes,prime_award_outlayed_amount_from_COVID-19_supplementals,prime_award_obligated_amount_from_COVID-19_supplementals,prime_award_outlayed_amount_from_IIJA_supplemental,prime_award_obligated_amount_from_IIJA_supplemental,prime_award_total_outlayed_amount,prime_award_base_action_date,prime_award_base_action_date_fiscal_year,prime_award_latest_action_date,prime_award_latest_action_date_fiscal_year,prime_award_period_of_performance_start_date,prime_award_period_of_performance_current_end_date,prime_award_period_of_performance_potential_end_date,prime_award_awarding_agency_code,prime_award_awarding_agency_name,prime_award_awarding_sub_agency_code,prime_award_awarding_sub_agency_name,prime_award_awarding_office_code,prime_award_awarding_office_name,prime_award_funding_agency_code,prime_award_funding_agency_name,prime_award_funding_sub_agency_code,prime_award_funding_sub_agency_name,prime_award_funding_office_code,prime_award_funding_office_name,prime_award_treasury_accounts_funding_this_award,prime_award_federal_accounts_funding_this_award,prime_award_object_classes_funding_this_award,prime_award_program_activities_funding_this_award,prime_awardee_uei,prime_awardee_duns,prime_awardee_name,prime_awardee_dba_name,prime_awardee_parent_uei,prime_awardee_parent_duns,prime_awardee_parent_name,prime_awardee_country_code,prime_awardee_country_name,prime_awardee_address_line_1,prime_awardee_city_name,prime_awardee_county_fips_code,prime_awardee_county_name,prime_awardee_state_fips_code,prime_awardee_state_code,prime_awardee_state_name,prime_awardee_zip_code,prime_award_summary_recipient_cd_original,prime_award_summary_recipient_cd_current,prime_awardee_foreign_postal_code,prime_awardee_business_types,prime_award_primary_place_of_performance_city_name,prime_award_primary_place_of_performance_county_fips_code,prime_award_primary_place_of_performance_county_name,prime_award_primary_place_of_performance_state_fips_code,prime_award_primary_place_of_performance_state_code,prime_award_primary_place_of_performance_state_name,prime_award_primary_place_of_performance_address_zip_code,prime_award_summary_place_of_performance_cd_original,prime_award_summary_place_of_performance_cd_current,prime_award_primary_place_of_performance_country_code,prime_award_primary_place_of_performance_country_name,prime_award_base_transaction_description,prime_award_project_title,prime_award_naics_code,prime_award_naics_description,prime_award_national_interest_action_code,prime_award_national_interest_action,subaward_type,subaward_sam_report_id,subaward_sam_report_year,subaward_sam_report_month,subaward_number,subaward_amount,subaward_action_date,subaward_action_date_fiscal_year,subawardee_uei,subawardee_duns,subawardee_name,subawardee_dba_name,subawardee_parent_uei,subawardee_parent_duns,subawardee_parent_name,subawardee_country_code,subawardee_country_name,subawardee_address_line_1,subawardee_city_name,subawardee_state_code,subawardee_state_name,subawardee_zip_code,subaward_recipient_cd_original,subaward_recipient_cd_current,subawardee_foreign_postal_code,subawardee_business_types,subaward_primary_place_of_performance_city_name,subaward_primary_place_of_performance_state_code,subaward_primary_place_of_performance_state_name,subaward_primary_place_of_performance_address_zip_code,subaward_place_of_performance_cd_original,subaward_place_of_performance_cd_current,subaward_primary_place_of_performance_country_code,subaward_primary_place_of_performance_country_name,subaward_description,subawardee_highly_compensated_officer_1_name,subawardee_highly_compensated_officer_1_amount,subawardee_highly_compensated_officer_2_name,subawardee_highly_compensated_officer_2_amount,subawardee_highly_compensated_officer_3_name,subawardee_highly_compensated_officer_3_amount,subawardee_highly_compensated_officer_4_name,subawardee_highly_compensated_officer_4_amount,subawardee_highly_compensated_officer_5_name,subawardee_highly_compensated_officer_5_amount,usaspending_permalink,subaward_sam_report_last_modified_date
CONT_AWD_80GSFC22CA019_8000_-NONE-_-NONE-,80GSFC22CA019,,114501641.07,Q: Not Designated Nonemergency/Emergency/Disaster/Wildfire Suppression,,,,,104779772.66,2022-04-20,2022,2025-09-30,2025,2022-06-01,2027-09-30,2029-05-31,080,National Aeronautics and Space Administration (NASA),8000,NATIONAL AERONAUTICS AND SPACE ADMINISTRATION,80GSFC,NASA GODDARD SPACE FLIGHT CENTER,080,National Aeronautics and Space Administration (NASA),8000,NATIONAL AERONAUTICS AND SPACE ADMINISTRATION,80GSFC,NASA GODDARD SPACE FLIGHT CENTER,080-2022/2023-0120-000;080-2023/2024-0120-000;080-2024/2025-0120-000;080-2024/2025-0122-000;080-2025/2026-0120-000,080-0120;080-0122,25.5: Research and development contracts,"0001: SAFETY, SECURITY AND MISSION SERVICES (DIRECT);0001: SCIENCE (DIRECT);0801: CROSS AGENCY SUPPORT (REIMBURSABLE)",ZBPQEJVECCT4,,PERATON INC.,,ZBPQEJVECCT4,,PERATON INC.,USA,UNITED STATES,12975 WORLDGATE DR STE 7322,HERNDON,51059,FAIRFAX,51,VA,VIRGINIA,201706008,VA-11,VA-11,,For Profit Organization,PALESTINE,48001,ANDERSON,48,TX,TEXAS,758032169,TX-06,TX-06,USA,UNITED STATES,OPERATIONS AND MANAGEMENT OF THE NASA BALLOON FACILITY,,541330,ENGINEERING SERVICES,,,sub-contract,AA9D4AF8-FCB8-11EF-8E2A-E7034F2D18CD,2024,9,PO-0065490,33990.00,2024-08-15,2024,TB1FS3UMCPG3,121801120,PROVANTAGE LLC,,C21GT9GYC1H3,,PROVANTAGE LLC,USA,UNITED STATES,7576 FREEDOM AVE NW,NORTH CANTON,OH,OHIO,447206902,OH-16,OH-13,,"FOR-PROFIT ORGANIZATION,LIMITED LIABILITY COMPANY,S CORPORATION",PALESTINE,TX,TEXAS,758032169,TX-05,TX-06,USA,United States,SONICWALL ADVANCED GATEWAY SEC SUITE BNDL MFG#01-SSC-8761,,,,,,,,,,,https://www.usaspending.gov/award/CONT_AWD_80GSFC22CA019_8000_-NONE-_-NONE-/,2024-09-11 00:00:00+00
CONT_AWD_0031_9700_FA875009D0022_9700,0031,FA875009D0022,,,,,,,,2013-08-29,2013,2014-12-01,2015,2013-08-29,2014-08-28,2014-08-28,097,Department of Defense (DOD),5700,DEPT OF THE AIR FORCE,FA8750,FA8750  AFRL RIK,097,Department of Defense (DOD),5700,DEPT OF THE AIR FORCE,F4HBEB,AFRL RIEB,,,,,EJGKYVW1NLL5,963519939,"INTELLIGENT SOFTWARE SOLUTIONS, INC.",I S S,EJGKYVW1NLL5,963519939,INTELLIGENT SOFTWARE SOLUTIONS  INC.,UNITED STATES,,5450 TECH CENTER DR STE 400,COLORADO SPRINGS,,,08,CO,,,CO-CO05,CO-05,809192341,"For Profit Organization,Limited Liability Company",COLORADO SPRINGS,08041,EL PASO,08,CO,COLORADO,809192341,CO-05,CO-05,USA,UNITED STATES,IGF::OT::IGF US COAST GUARD AND CJSOTF-A WEBTAS TK TECHNICAL EXPERTISE AND DEVELOPMENT,,541712,"RESEARCH AND DEVELOPMENT IN THE PHYSICAL, ENGINEERING, AND LIFE SCIENCES (EXCEPT BIOTECHNOLOGY)",NONE,NONE,sub-contract,98DEF73A-FCB8-11EF-8E2A-E7034F2D18CD,2014,8,660-0031-0007,1209978.27,2014-01-07,2014,PPEKTM9CTAJ3,085851181,"ASSURED INFORMATION SECURITY, INC.",I S S,PPEKTM9CTAJ3,085851181,"ASSURED INFORMATION SECURITY, INC.",USA,UNITED STATES,153 BROOKS RD STE 5,ROME,NY,NEW YORK,134414203,NY-24,NY-21,,FOR-PROFIT ORGANIZATION,ROME,NY,NEW YORK,134414121,NY-24,NY-21,USA,United States,"THE CONTRACTOR SHALL PROVIDE ENGINEERING SERVICES TO SUPPORT THE ENHANCEMENT, OPERATION, MAINTENANCE,
AND SUSTAINMENT OF THE SWAT SECUREVIEW 3.0 PLATFORM.SECUREVIEW VPN SUPPORT - SV CURRENTLY HAS BEEN INTEGRATED WITH CISCO AND ARUBU VPN
CONCENTRATORS. MANY SITES HAVE ESTABLISHED OPERATIONAL ENVIRONMENTS WITH JUNIPER AND
SONICWALL VPN CONCENTRATORS. INTEGRATING SV WITH ADDITIONAL COMMERCIAL VPN CONCENTRATORS
WILL ALLOW ENABLE SITES TO REUSE EXISTING INFRASTRUCTURE, AVOID TRAINING STAFF ON NEW CONCENTRATORS
AND LOWER OVERALL COST TO ACQUIRE SV CAPABILITIES.
2. SECUREVIEW IMPROVED DISPLAY HANDLING - SURFMAN REPLACEMENT Â€“ PROVIDES MULTI-MONITOR
SUPPORT, SUPPORT FOR INTEL, AND AMD GRAPHICS CARDS, BETTER PERFORMANCE, AND BETTER INTEGRATION
WITH MULTIVIEW.
3. SECUREVIEW PLATFORM AUTHENTICATION - PROVIDES THE UIVM WITH USER AUTHENTICATION AND AUDITING.
ALSO PROVIDES THE ABILITY TO HIDE VMS ON A PER-USER BASIS. CAPABILITY HAS BEEN REQUESTED BY
SEVERAL SV SITES.
4. SECUREVIEW SNAPSHOT VM - ALLOW THE SVSM TO INITIATE A SNAPSHOT ON A REMOTE SECUREVIEW
CLIENT MACHINE (SNAPSHOT SAVED ON THE SV CLIENT MACHINE).SECUREVIEW APPLICATION INTEGRATION API - ADD SUPPORT IN MULTIVIEW FOR THIRD PARTY APPLICATION
DEVELOPMENT EXTENDING THE USEFULNESS OF CROSS DOMAIN COMPOSITING TO INDIVIDUAL APPLICATIONS. MONTHLY REPORTS REQUIRED",Charles Green,306441.00,Kenneth Zatyko,294153.00,Steven Flint,298965.00,John Bay,270714.00,Barry McKinney,300185.00,https://www.usaspending.gov/award/CONT_AWD_0031_9700_FA875009D0022_9700/,2014-08-08 00:00:00+00
CONT_AWD_N0001921C0020_9700_-NONE-_-NONE-,N0001921C0020,,7953125056.50,Q: Not Designated Nonemergency/Emergency/Disaster/Wildfire Suppression,,,,,,2020-12-28,2021,2025-06-24,2025,2020-12-31,2027-12-30,2027-12-30,097,Department of Defense (DOD),1700,DEPT OF THE NAVY,N00019,NAVAL AIR SYSTEMS COMMAND,097,Department of Defense (DOD),1700,DEPT OF THE NAVY,N00019,NAVAL AIR SYSTEMS COMMAND,017-2021/2021-1804-000;057-2021/2021-3400-000;057-2021/2021-3840-000,017-1804;057-3400;057-3840,25.7: Operation and maintenance of equipment;31.0: Equipment,0000: UNKNOWN/OTHER;0001: OPERATING FORCES,G4KDGE4JFFK7,,LOCKHEED MARTIN CORPORATION,,ZFN2JJXBLZT3,,LOCKHEED MARTIN CORPORATION,USA,UNITED STATES,1 LOCKHEED BLVD BLDG 10,FORT WORTH,48439,TARRANT,48,TX,TEXAS,761083619,TX-12,TX-12,,"For Profit Organization,Manufacturer of Goods",FORT WORTH,48439,TARRANT,48,TX,TEXAS,761082063,TX-12,TX-12,USA,UNITED STATES,FY21-23 GLOBAL F-35 AIR SYSTEM SUSTAINMENT,,336411,AIRCRAFT MANUFACTURING,,,sub-contract,5FD17E58-FCB9-11EF-8E2A-E7034F2D18CD,2024,9,4106054619,57290.00,2023-10-16,2024,YK69EKFSJ6D8,,"BLUEALLY TECHNOLOGY SOLUTIONS, LLC",LOCKHEED MARTIN CORPORATION,,,,USA,UNITED STATES,9979 MUIRLANDS BLVD,IRVINE,CA,CALIFORNIA,926182508,CA-45,CA-47,,,IRVINE,CA,CALIFORNIA,926180000,CA-45,CA-47,USA,United States,SONICWALL / VG ADDON ENT MGMT FY23,,,,,,,,,,,https://www.usaspending.gov/award/CONT_AWD_N0001921C0020_9700_-NONE-_-NONE-/,2024-09-09 00:00:00+00
CONT_AWD_N0001920F0238_9700_N0001920D0007_9700,N0001920F0238,N0001920D0007,33557484.32,N: Emergency P.L. 116-136;Q: Not Designated Nonemergency/Emergency/Disaster/Wildfire Suppression,0,373020.79,,,,2020-08-17,2020,2025-05-29,2025,2020-08-14,2026-01-30,2026-01-30,097,Department of Defense (DOD),1700,DEPT OF THE NAVY,N00019,NAVAL AIR SYSTEMS COMMAND,097,Department of Defense (DOD),1700,DEPT OF THE NAVY,N00019,NAVAL AIR SYSTEMS COMMAND,017-2020/2021-1319-000;057-2020/2021-3600-000;057-2021/2022-3600-000,017-1319;057-3600,25.5: Research and development contracts,0001: BASIC RESEARCH;OPTN: FIELD IS OPTIONAL PRIOR TO FY21,G4KDGE4JFFK7,,LOCKHEED MARTIN CORPORATION,,ZFN2JJXBLZT3,,LOCKHEED MARTIN CORPORATION,USA,UNITED STATES,1 LOCKHEED BLVD BLDG 10,FORT WORTH,48439,TARRANT,48,TX,TEXAS,761083619,TX-12,TX-12,,"For Profit Organization,Manufacturer of Goods",FORT WORTH,48439,TARRANT,48,TX,TEXAS,761083619,TX-12,TX-12,USA,UNITED STATES,ODIN BASE KIT (DEPLOYMENT) CY 2020,,336411,AIRCRAFT MANUFACTURING,,,sub-contract,5F2EF8AE-FCB9-11EF-8E2A-E7034F2D18CD,2024,5,6574072845,55945.00,2024-01-01,2024,YK69EKFSJ6D8,,"BLUEALLY TECHNOLOGY SOLUTIONS, LLC",,,,,USA,UNITED STATES,9979 MUIRLANDS BLVD,IRVINE,CA,CALIFORNIA,926182508,CA-45,CA-47,,,IRVINE,CA,CALIFORNIA,926182508,CA-45,CA-47,USA,United States,1 YEAR ATP LICENSE WITH MAINTENANCE FORTIGATE VM32V OFF NET LICENSE FORTINET FORTIGATE-VM02V 24X7 ADVANCED T FORTINET FORTIGATE-VM02V-OFF... SONICWALL SMA 50 USER LICENSE SONICWALL SMA 8200V SUPT 50 USER 1YR SONICWALL SMA 8200V (VA) WATCHGUARD FIREBOXV MEDIUM WITH 1YR,,,,,,,,,,,https://www.usaspending.gov/award/CONT_AWD_N0001920F0238_9700_N0001920D0007_9700/,2024-05-29 00:00:00+00
CONT_AWD_N0001921C0020_9700_-NONE-_-NONE-,N0001921C0020,,7953125056.50,Q: Not Designated Nonemergency/Emergency/Disaster/Wildfire Suppression,,,,,,2020-12-28,2021,2025-06-24,2025,2020-12-31,2027-12-30,2027-12-30,097,Department of Defense (DOD),1700,DEPT OF THE NAVY,N00019,NAVAL AIR SYSTEMS COMMAND,097,Department of Defense (DOD),1700,DEPT OF THE NAVY,N00019,NAVAL AIR SYSTEMS COMMAND,017-2021/2021-1804-000;057-2021/2021-3400-000;057-2021/2021-3840-000,017-1804;057-3400;057-3840,25.7: Operation and maintenance of equipment;31.0: Equipment,0000: UNKNOWN/OTHER;0001: OPERATING FORCES,G4KDGE4JFFK7,,LOCKHEED MARTIN CORPORATION,,ZFN2JJXBLZT3,,LOCKHEED MARTIN CORPORATION,USA,UNITED STATES,1 LOCKHEED BLVD BLDG 10,FORT WORTH,48439,TARRANT,48,TX,TEXAS,761083619,TX-12,TX-12,,"For Profit Organization,Manufacturer of Goods",FORT WORTH,48439,TARRANT,48,TX,TEXAS,761082063,TX-12,TX-12,USA,UNITED STATES,FY21-23 GLOBAL F-35 AIR SYSTEM SUSTAINMENT,,336411,AIRCRAFT MANUFACTURING,,,sub-contract,60367D94-FCB9-11EF-8E2A-E7034F2D18CD,2022,1,6574051372,261058.00,2021-12-01,2022,S6RXX8VMJK46,080801130,"FEDDATA TECHNOLOGY SOLUTIONS, LLC",LOCKHEED MARTIN CORPORATION,FNELX8M8GAH7,031096105,CLEAR FRACTURE LLC,USA,UNITED STATES,9045 JUNCTION DR,ANNAPOLIS JUNCTION,MD,MARYLAND,207011155,MD-02,MD-03,,"FOR-PROFIT ORGANIZATION,LIMITED LIABILITY COMPANY",ANNAPOLIS JUNCTION,MD,MARYLAND,207011155,MD-02,MD-03,USA,United States,24X7 SUPT FOR SMA 8200V 250 USER - 1YR SONICWALL SMA 250 USER LICENSE - STACKAB SONICWALL SMA 8200V (VA),Rick  Hardy,671538.00,Robert  Young,751361.00,William  Reybold,562650.00,Patrick  McGowan,1201262.00,Daniel  Gilliam,925000.00,https://www.usaspending.gov/award/CONT_AWD_N0001921C0020_9700_-NONE-_-NONE-/,2022-01-12 00:00:00+00
CONT_AWD_N0001921C0020_9700_-NONE-_-NONE-,N0001921C0020,,7953125056.50,Q: Not Designated Nonemergency/Emergency/Disaster/Wildfire Suppression,,,,,,2020-12-28,2021,2025-06-24,2025,2020-12-31,2027-12-30,2027-12-30,097,Department of Defense (DOD),1700,DEPT OF THE NAVY,N00019,NAVAL AIR SYSTEMS COMMAND,097,Department of Defense (DOD),1700,DEPT OF THE NAVY,N00019,NAVAL AIR SYSTEMS COMMAND,017-2021/2021-1804-000;057-2021/2021-3400-000;057-2021/2021-3840-000,017-1804;057-3400;057-3840,25.7: Operation and maintenance of equipment;31.0: Equipment,0000: UNKNOWN/OTHER;0001: OPERATING FORCES,G4KDGE4JFFK7,,LOCKHEED MARTIN CORPORATION,,ZFN2JJXBLZT3,,LOCKHEED MARTIN CORPORATION,USA,UNITED STATES,1 LOCKHEED BLVD BLDG 10,FORT WORTH,48439,TARRANT,48,TX,TEXAS,761083619,TX-12,TX-12,,"For Profit Organization,Manufacturer of Goods",FORT WORTH,48439,TARRANT,48,TX,TEXAS,761082063,TX-12,TX-12,USA,UNITED STATES,FY21-23 GLOBAL F-35 AIR SYSTEM SUSTAINMENT,,336411,AIRCRAFT MANUFACTURING,,,sub-contract,60368028-FCB9-11EF-8E2A-E7034F2D18CD,2021,6,6574050815,261058.00,2021-05-27,2021,FNELX8M8GAH7,031096105,CLEAR FRACTURE LLC,LOCKHEED MARTIN CORPORATION,FNELX8M8GAH7,031096105,CLEAR FRACTURE LLC,USA,UNITED STATES,7095 SAMUEL MORSE DR STE 100,COLUMBIA,MD,MARYLAND,210463418,MD-03,MD-03,,"FOR-PROFIT ORGANIZATION,LIMITED LIABILITY COMPANY",COLUMBIA,MD,MARYLAND,210463418,MD-03,MD-03,USA,United States,24X7 SUPT FOR SMA 8200V 250 USER - 1YR  SONICWALL,Daniel  Batelka,361272.00,Wayne  Schmidt,304488.00,Gwen  Pal,321992.00,Leslie  Gibbs,325394.00,Lonny  Anderson,499036.00,https://www.usaspending.gov/award/CONT_AWD_N0001921C0020_9700_-NONE-_-NONE-/,2021-06-09 00:00:00+00
CONT_AWD_N0001921C0020_9700_-NONE-_-NONE-,N0001921C0020,,7953125056.50,Q: Not Designated Nonemergency/Emergency/Disaster/Wildfire Suppression,,,,,,2020-12-28,2021,2025-06-24,2025,2020-12-31,2027-12-30,2027-12-30,097,Department of Defense (DOD),1700,DEPT OF THE NAVY,N00019,NAVAL AIR SYSTEMS COMMAND,097,Department of Defense (DOD),1700,DEPT OF THE NAVY,N00019,NAVAL AIR SYSTEMS COMMAND,017-2021/2021-1804-000;057-2021/2021-3400-000;057-2021/2021-3840-000,017-1804;057-3400;057-3840,25.7: Operation and maintenance of equipment;31.0: Equipment,0000: UNKNOWN/OTHER;0001: OPERATING FORCES,G4KDGE4JFFK7,,LOCKHEED MARTIN CORPORATION,,ZFN2JJXBLZT3,,LOCKHEED MARTIN CORPORATION,USA,UNITED STATES,1 LOCKHEED BLVD BLDG 10,FORT WORTH,48439,TARRANT,48,TX,TEXAS,761083619,TX-12,TX-12,,"For Profit Organization,Manufacturer of Goods",FORT WORTH,48439,TARRANT,48,TX,TEXAS,761082063,TX-12,TX-12,USA,UNITED STATES,FY21-23 GLOBAL F-35 AIR SYSTEM SUSTAINMENT,,336411,AIRCRAFT MANUFACTURING,,,sub-contract,62462D32-FCB9-11EF-8E2A-E7034F2D18CD,2024,4,4105745030,899976.00,2023-02-07,2023,NPSNRUN1YF28,100714810,"VIRTUAL GRAFFITI, INC.",LOCKHEED MARTIN CORPORATION,,,,USA,UNITED STATES,9979 MUIRLANDS BLVD,IRVINE,CA,CALIFORNIA,926182508,CA-45,CA-47,,FOR-PROFIT ORGANIZATION,IRVINE,CA,CALIFORNIA,926182508,CA-45,CA-47,USA,United States,ALIS/ODIN ENT - SONICWALL-VIRTUAL FY23 AUSTRALIA - SONICWALL-VIRTUAL FY23 BEAUFORT - SONICWALL-VIRTUAL FY23 CHEONGJU  FMS 3 - SONICWALL-VIRTUAL FY23 DENMARK - SONICWALL-VIRTUAL FY23 EDWARDS - SONICWALL-VIRTUAL FY23 EGLIN - SONICWALL-VIRTUAL FY23 ITALY - SONICWALL-VIRTUAL FY23 LUKE - SONICWALL-VIRTUAL FY23 MISAWA  FMS 2 - SONICWALL-VIRTUAL FY23 NETHERLAND - SONICWALL-VIRTUAL FY23 NEVATIM  FMS 1 - SONICWALL-VIRTUAL FY23 NORWAY - SONICWALL-VIRTUAL FY23 UK - SONICWALL-VIRTUAL FY23 USAF - SONICWALL-VIRTUAL FY23 US DEPOT MGMT - SONICWALL-VIRTUAL FY23 USMC - SONICWALL-VIRTUAL FY23 USN - SONICWALL-VIRTUAL FY23 USRL - SONICWALL-VIRTUAL FY23,,,,,,,,,,,https://www.usaspending.gov/award/CONT_AWD_N0001921C0020_9700_-NONE-_-NONE-/,2024-04-30 00:00:00+00
CONT_AWD_N0001922C0041_9700_-NONE-_-NONE-,N0001922C0041,,1275343469.91,Q: Not Designated Nonemergency/Emergency/Disaster/Wildfire Suppression,,,,,1924.90,2022-05-17,2022,2025-06-30,2025,2022-05-17,2027-03-31,2027-03-31,097,Department of Defense (DOD),1700,DEPT OF THE NAVY,N00019,NAVAL AIR SYSTEMS COMMAND,097,Department of Defense (DOD),1700,DEPT OF THE NAVY,N00019,NAVAL AIR SYSTEMS COMMAND,097-2023/2024-0400-000,097-0400,25.3: Other goods and services from Federal sources;25.5: Research and development contracts,009S: MISCELLANEOUS,G4KDGE4JFFK7,,LOCKHEED MARTIN CORPORATION,,ZFN2JJXBLZT3,,LOCKHEED MARTIN CORPORATION,USA,UNITED STATES,1 LOCKHEED BLVD BLDG 10,FORT WORTH,48439,TARRANT,48,TX,TEXAS,761083619,TX-12,TX-12,,"For Profit Organization,Manufacturer of Goods",FORT WORTH,48439,TARRANT,48,TX,TEXAS,761083619,TX-12,TX-12,USA,UNITED STATES,"F-35 DEVELOPMENTAL FOUNDATION CONTRACT 3 - THIS CONTRACT PROVIDES A FOUNDATION, IN SUPPORT OF F-35 DEVELOPMENTAL FLIGHT TEST AT EDWARDS AIR FORCE BASE, NAVAL AIR STATION PATUXENT RIVER, AND F-35 DEVELOPMENTAL LABORATORY FACILITIES.",,541715,"RESEARCH AND DEVELOPMENT IN THE PHYSICAL, ENGINEERING, AND LIFE SCIENCES (EXCEPT NANOTECHNOLOGY AND BIOTECHNOLOGY)",,,sub-contract,62D05908-FCB9-11EF-8E2A-E7034F2D18CD,2024,11,6574080038,60764.00,2024-10-01,2025,YK69EKFSJ6D8,,"BLUEALLY TECHNOLOGY SOLUTIONS, LLC",LOCKHEED MARTIN CORPORATION,,,,USA,UNITED STATES,9979 MUIRLANDS BLVD,IRVINE,CA,CALIFORNIA,926182508,CA-45,CA-47,,,IRVINE,CA,CALIFORNIA,926182508,CA-45,CA-47,USA,United States,7210/7200 -24X7 SUPPORT 250 USER 7210/7200 - 24X7 SUPPORT 50 USER SONICWALL SMA 7200 SUPPORT,,,,,,,,,,,https://www.usaspending.gov/award/CONT_AWD_N0001922C0041_9700_-NONE-_-NONE-/,2024-11-25 00:00:00+00
CONT_AWD_W912HZ24F0331_9700_W912DY22D0040_9700,W912HZ24F0331,W912DY22D0040,27869724.85,,,,,,,2024-09-20,2024,2025-06-24,2025,2024-09-30,2025-10-16,2025-10-16,097,Department of Defense (DOD),2100,DEPT OF THE ARMY,W912HZ,W2R2 USA ENGR R AND D CTR,097,Department of Defense (DOD),2100,DEPT OF THE ARMY,W912HZ,W2R2 USA ENGR R AND D CTR,,,,,ZME8YC3PJUR7,,"BOWHEAD TOTAL ENTERPRISE SOLUTIONS, LLC",,G94RXHL8AQ91,,BOWHEAD TOTAL ENTERPRISE SOLUTIONS  LLC,USA,UNITED STATES,6564 LOISDALE CT STE 900,SPRINGFIELD,51059,FAIRFAX,51,VA,VIRGINIA,221501822,VA-11,VA-11,,"Alaskan Native Corporation Owned Firm,Minority Owned Business,Self Certified Small Disadvantaged Business,For Profit Organization,Limited Liability Company,Native American Owned",SPRINGFIELD,51059,FAIRFAX,51,VA,VIRGINIA,221500332,VA-11,VA-11,USA,UNITED STATES,MATERIALS & ODCS,,541513,COMPUTER FACILITIES MANAGEMENT SERVICES,,,sub-contract,05CDA9B0-FCBC-11EF-8E2A-E7034F2D18CD,2025,2,2500620,159878.00,2025-02-14,2025,R98MW4ZKUUK3,603814054,GOVERNMENT ACQUISITIONS INC,,R98MW4ZKUUK3,603814054,GOVERNMENT ACQUISITIONS INC,USA,UNITED STATES,"2060 READING ROAD
FL 3",CINCINNATI,OH,OHIO,452021400,OH-01,OH-01,,"FOR-PROFIT ORGANIZATION,S CORPORATION",,,,,,,USA,,SONICWALL NSA,John  Gelsinger,458345.00,Tracy  Pavillard,1153018.00,Christopher  Gordon,738289.00,Jay  Lambke,1533850.00,Todd  Brown,538603.00,https://www.usaspending.gov/award/CONT_AWD_W912HZ24F0331_9700_W912DY22D0040_9700/,2025-02-28 00:00:00+00
